{
  "$schema": "https://json-schema.org/draft/2020-12/schema",
  "$id": "urn:decluster:schema:reproduction-environment:v1",
  "type": "object",
  "additionalProperties": false,
  "required": ["schema_version", "python", "source_archive", "project_root", "requirements", "dependency_directory"],
  "properties": {
    "schema_version": {"const": 1},
    "python": {
      "type": "object",
      "additionalProperties": false,
      "required": ["implementation", "version", "system", "machine"],
      "properties": {
        "implementation": {"const": "cpython"},
        "version": {"type": "string", "pattern": "^[0-9]+\\.[0-9]+$"},
        "system": {"type": "string", "minLength": 1},
        "machine": {"type": "string", "minLength": 1}
      }
    },
    "source_archive": {"type": "string", "minLength": 1},
    "project_root": {"type": "string", "minLength": 1},
    "requirements": {"type": "string", "minLength": 1},
    "dependency_directory": {"type": "string", "minLength": 1}
  }
}
