{
  "schema_version": 1,
  "python": {
    "implementation": "cpython",
    "version": "3.13",
    "system": "Darwin",
    "machine": "arm64"
  },
  "source_archive": "sources/decluster-4fa950c-runtime.tar",
  "project_root": "decluster",
  "requirements": "reproduction/ns1r-change-readoff/requirements.lock",
  "dependency_directory": "reproduction/ns1r-change-readoff"
}
