{
  "schema_version": 1,
  "python": {"implementation": "cpython", "version": "3.13", "system": "Darwin", "machine": "arm64"},
  "source_archive": "sources/decluster-3f0d21b-runtime.tar",
  "project_root": "decluster",
  "requirements": "reproduction/counting-router/requirements.lock",
  "dependency_directory": "dependencies"
}
