{
  "schema_version": 1,
  "python": {
    "implementation": "cpython",
    "version": "3.13",
    "system": "Darwin",
    "machine": "arm64"
  },
  "source_archive": "sources/decluster-1f984d2-runtime.tar",
  "project_root": "decluster",
  "requirements": "reproduction/pseudonym-graph-contract/requirements.lock",
  "dependency_directory": "reproduction/pseudonym-graph-contract"
}
