{
  "schema_version": 1,
  "python": {
    "implementation": "cpython",
    "version": "3.13",
    "system": "Darwin",
    "machine": "arm64"
  },
  "source_archive": "sources/decluster-6853a94-runtime.tar",
  "project_root": "decluster",
  "requirements": "reproduction/intersection-cluster-fixture/requirements.lock",
  "dependency_directory": "reproduction/intersection-cluster-fixture"
}
