{
  "schema_version": 1,
  "python": {"implementation": "cpython", "version": "3.13", "system": "Darwin", "machine": "arm64"},
  "source_archive": "sources/decluster-9758b84-runtime.tar",
  "project_root": "decluster",
  "requirements": "reproduction/amount-pairwise-family/requirements.lock",
  "dependency_directory": "dependencies"
}
