{
  "schema_version": 1,
  "python": {
    "implementation": "cpython",
    "version": "3.13",
    "system": "Darwin",
    "machine": "arm64"
  },
  "source_archive": "sources/decluster-9fc6732-runtime.tar",
  "project_root": "decluster",
  "requirements": "reproduction/anchor-axis-families/requirements.lock",
  "dependency_directory": "reproduction/anchor-axis-families"
}
