{
  "schema_version": 1,
  "python": {
    "implementation": "cpython",
    "version": "3.13",
    "system": "Darwin",
    "machine": "arm64"
  },
  "source_archive": "sources/decluster-1fe99db-runtime.tar",
  "project_root": "decluster",
  "requirements": "reproduction/weight-sensitivity/requirements.lock",
  "dependency_directory": "reproduction/weight-sensitivity"
}
