{
  "schema_version": 1,
  "python": {
    "implementation": "cpython",
    "version": "3.13",
    "system": "Darwin",
    "machine": "arm64"
  },
  "source_archive": "sources/decluster-08aff18-runtime.tar",
  "project_root": "decluster",
  "requirements": "reproduction/bayes-vs-fs/requirements.lock",
  "dependency_directory": "reproduction/bayes-vs-fs"
}
