{
  "schema_version": 1,
  "python": {
    "implementation": "cpython",
    "version": "3.13",
    "system": "Darwin",
    "machine": "arm64"
  },
  "source_archive": "sources/decluster-f8c2b39-runtime.tar",
  "project_root": "decluster",
  "requirements": "reproduction/fs-temporal/requirements.lock",
  "dependency_directory": "reproduction/fs-temporal"
}
