{
  "schema_version": 1,
  "python": {
    "implementation": "cpython",
    "version": "3.13",
    "system": "Darwin",
    "machine": "arm64"
  },
  "source_archive": "sources/decluster-4de0107-runtime.tar",
  "project_root": "decluster",
  "requirements": "reproduction/graph-deanon-controls/requirements.lock",
  "dependency_directory": "reproduction/graph-deanon-controls"
}
